{
  "$schema": "https://json-schema.org/draft/2020-12/schema",
  "$id": "https://github.com/Workers-Intelligence-Commons/wpt-llm/schemas/model.schema.json",
  "title": "WPT model recipe (data/recipes/models/<name>.json): everything that changes the resulting model",
  "type": "object",
  "additionalProperties": false,
  "required": ["schema", "data", "model", "training", "drafter", "posttrain"],
  "$defs": {
    "name": {"type": "string", "pattern": "^[a-z0-9][a-z0-9._-]*$"}
  },
  "properties": {
    "schema": {"const": 6},
    "data": {
      "description": "what `wpt-dataset build` builds; recipes with the same data share one dataset",
      "type": "object",
      "additionalProperties": false,
      "required": ["mixture", "tokenizer", "total_tokens", "held_out"],
      "properties": {
        "mixture": {"$ref": "#/$defs/name", "description": "a file name in data/recipes/mixtures/, without .json"},
        "tokenizer": {"$ref": "#/$defs/name", "description": "a file name in data/recipes/tokenizers/, without .json"},
        "total_tokens": {"type": "integer", "minimum": 1},
        "held_out": {"type": "number", "minimum": 0, "exclusiveMaximum": 1, "description": "share of every source's documents kept out of training"}
      }
    },
    "model": {
      "description": "the architecture's numbers (docs/model.md; wpt_model.ModelConfig without vocab_size, which the tokenizer gives, and block_size, the last stage's window)",
      "type": "object",
      "additionalProperties": false,
      "required": ["n_layer", "global_attention", "d_model", "kda_heads", "kda_head_dim", "attention_heads",
                   "attention_head_dim", "query_rank", "output_groups", "output_rank", "index_heads",
                   "index_head_dim", "index_top_k", "n_experts", "top_k", "expert_width", "latent_width", "shared_width",
                   "engram_layers", "engram_order", "engram_heads", "engram_dim", "engram_table_size"],
      "properties": {
        "n_layer": {"type": "integer", "minimum": 2, "description": "a global layer (CSA or HCA) every 4th layer and the last, KDA elsewhere"},
        "global_attention": {"type": "array", "items": {"enum": ["CSA", "HCA"]}, "minItems": 1,
                             "description": "the kind of each global layer, in order: one per 4th layer and the last"},
        "d_model": {"type": "integer", "minimum": 1, "description": "width of the residual streams"},
        "kda_heads": {"type": "integer", "minimum": 1},
        "kda_head_dim": {"type": "integer", "minimum": 1, "description": "keys and values of a KDA head"},
        "attention_heads": {"type": "integer", "minimum": 1, "description": "query heads of CSA, HCA and the multi-token prediction block"},
        "attention_head_dim": {"type": "integer", "minimum": 128, "multipleOf": 64, "description": "each query head and the one key-value head: the 64 rotary dimensions and FP8 blocks of 64"},
        "query_rank": {"type": "integer", "minimum": 1, "description": "width of the query latent, shared with the indexer"},
        "output_groups": {"type": "integer", "minimum": 1, "description": "groups of the grouped output projection; divides attention_heads"},
        "output_rank": {"type": "integer", "minimum": 1, "description": "width of each group's intermediate output"},
        "index_heads": {"type": "integer", "minimum": 1, "description": "query heads of the CSA indexer"},
        "index_head_dim": {"type": "integer", "minimum": 128, "description": "each indexer head and key: a power of 2 (the Hadamard rotation), more than the 64 rotary dimensions"},
        "index_top_k": {"type": "integer", "minimum": 1, "description": "merged entries each query attends to in a CSA layer"},
        "n_experts": {"type": "integer", "minimum": 2, "description": "routed experts per layer"},
        "top_k": {"type": "integer", "minimum": 1, "description": "routed experts per token, fewer than n_experts"},
        "expert_width": {"type": "integer", "minimum": 1, "description": "hidden width of a routed expert"},
        "latent_width": {"type": "integer", "minimum": 1, "description": "width of the space routed experts work in"},
        "shared_width": {"type": "integer", "minimum": 1, "description": "hidden width of each of the 2 shared experts"},
        "engram_layers": {"type": "array", "items": {"type": "integer", "minimum": 1}, "uniqueItems": true,
                          "description": "layers (numbered from 1) that get Engram memory"},
        "engram_order": {"type": "integer", "minimum": 2, "description": "largest N-gram; orders 2 .. N are read"},
        "engram_heads": {"type": "integer", "minimum": 1, "maximum": 16, "description": "hash heads per order"},
        "engram_dim": {"type": "integer", "minimum": 1, "description": "width of one table row"},
        "engram_table_size": {"type": "integer", "minimum": 2, "exclusiveMaximum": 2147483648,
                              "description": "each table has a distinct prime size, the smallest at or above this"}
      }
    },
    "training": {
      "type": "object",
      "additionalProperties": false,
      "required": ["method", "settings", "stages", "eval_every", "eval_batches", "seed"],
      "properties": {
        "method": {"type": "string", "minLength": 1, "description": "a built-in method of wpt_training, or a .py file"},
        "settings": {"type": "object", "additionalProperties": {"type": ["number", "string", "boolean"]},
                     "description": "the method's settings; those left out keep the method's defaults"},
        "stages": {
          "type": "array", "minItems": 1,
          "description": "trained in order, each on windows of its length (docs/training.md, \"Stages\"); the model's context is the last one's",
          "items": {
            "type": "object",
            "additionalProperties": false,
            "required": ["block_size", "steps", "batch_size"],
            "properties": {
              "block_size": {"type": "integer", "minimum": 2, "description": "tokens per training window in this stage"},
              "steps": {"type": "integer", "minimum": 1, "description": "maximum number of updates in this stage"},
              "batch_size": {"type": "integer", "minimum": 1, "description": "windows per update in this stage, over every process together"}
            }
          }
        },
        "eval_every": {"type": "integer", "minimum": 1},
        "eval_batches": {"type": "integer", "minimum": 1, "description": "global batches of the stage averaged per evaluation"},
        "seed": {"type": "integer", "minimum": 0}
      }
    },
    "drafter": {
      "description": "the drafter wpt-train trains at the end of the run, and wpt-posttrain at the end of every run (docs/model.md, \"The drafter\"; wpt_inference.drafting); a setting left out keeps its default",
      "type": "object",
      "additionalProperties": false,
      "properties": {
        "features": {"type": "array", "items": {"type": "integer", "minimum": 1}, "minItems": 1, "description": "the model layers whose hidden states the drafter reads, numbered from 1 to the model's n_layer (a run refuses another before it trains); default: wpt_model.drafter.feature_layers"},
        "layers": {"type": "integer", "minimum": 1, "description": "the drafter's backbone layers"},
        "block": {"type": "integer", "minimum": 1, "description": "tokens drafted per round"},
        "markov_rank": {"type": "integer", "minimum": 1, "description": "rank of the Markov head; default 256 x d_model / 4096"},
        "epochs": {"type": "integer", "minimum": 1},
        "learning_rate": {"type": "number", "exclusiveMinimum": 0},
        "weight_decay": {"type": "number", "minimum": 0},
        "warm_up": {"type": "number", "minimum": 0, "maximum": 1, "description": "share of the updates the learning rate rises over"},
        "clip": {"type": "number", "exclusiveMinimum": 0, "description": "gradient norm clipping"},
        "anchors": {"type": "integer", "minimum": 1, "description": "anchors drawn from each answer per epoch"},
        "batch": {"type": "integer", "minimum": 1, "description": "answers per update"},
        "prompts": {"type": "integer", "minimum": 2, "description": "training documents whose beginnings are prompts"},
        "prompt_tokens": {"type": "integer", "minimum": 1, "description": "the most tokens of a document's beginning in its prompt"},
        "answer_tokens": {"type": "integer", "minimum": 1, "description": "the most tokens of each answer the model writes"},
        "temperature": {"type": "number", "exclusiveMinimum": 0},
        "top_k": {"type": ["integer", "null"], "minimum": 1},
        "held_out": {"type": "number", "exclusiveMinimum": 0, "exclusiveMaximum": 1, "description": "share of the prompts kept apart for calibration and the measure"},
        "ece_bins": {"type": "integer", "minimum": 1},
        "seed": {"type": "integer", "minimum": 0}
      }
    },
    "posttrain": {
      "description": "the steps `wpt-posttrain` runs, in order: built-in step names or .py files, each alone or with its settings",
      "type": "array",
      "items": {
        "oneOf": [
          {"type": "string", "minLength": 1, "description": "a step, with its own settings"},
          {
            "type": "object",
            "additionalProperties": false,
            "required": ["step", "settings"],
            "description": "a step and the settings it changes",
            "properties": {
              "step": {"type": "string", "minLength": 1, "description": "a built-in step name or a .py file"},
              "settings": {"type": "object", "additionalProperties": {"type": ["number", "string", "boolean"]},
                           "description": "the step's settings (its file's SETTINGS); those left out keep the step's defaults"}
            }
          }
        ]
      }
    },
    "note": {"type": "string"}
  }
}
