{
  "schema": 6,
  "data": {
    "mixture": "classics",
    "tokenizer": "classics",
    "total_tokens": 4290110,
    "held_out": 0.05
  },
  "model": {
    "n_layer": 8,
    "global_attention": [
      "CSA",
      "HCA"
    ],
    "d_model": 512,
    "kda_heads": 4,
    "kda_head_dim": 128,
    "attention_heads": 8,
    "attention_head_dim": 128,
    "query_rank": 128,
    "output_groups": 2,
    "output_rank": 256,
    "index_heads": 8,
    "index_head_dim": 128,
    "index_top_k": 64,
    "n_experts": 32,
    "top_k": 4,
    "expert_width": 256,
    "latent_width": 256,
    "shared_width": 512,
    "engram_layers": [
      2
    ],
    "engram_order": 3,
    "engram_heads": 8,
    "engram_dim": 16,
    "engram_table_size": 50021
  },
  "training": {
    "method": "muon",
    "settings": {
      "warmup": 30
    },
    "stages": [
      {
        "block_size": 32768,
        "steps": 300,
        "batch_size": 8
      }
    ],
    "eval_every": 50,
    "eval_batches": 4,
    "seed": 1337
  },
  "drafter": {
    "prompts": 256,
    "prompt_tokens": 64,
    "answer_tokens": 256,
    "epochs": 10,
    "learning_rate": 0.0006,
    "held_out": 0.1,
    "anchors": 512,
    "batch": 8,
    "seed": 0
  },
  "posttrain": [],
  "note": "Untested in a full run: the first recipe sized for one 16 GB GPU (RTX 5080 Laptop), 102M parameters with 32K-token windows, trained with --recompute --micro-batch 1. Layer 4 is DeepSeek-V4's CSA (8 heads of 128 sharing one key-value head, an indexer of 8 heads of 128 and top 64, V4-Flash's scaled to the width), layer 8 is HCA, and the MTP block's attention is a 128-token window. With --recompute on an integrated Radeon 860M, one window of random tokens peaked at 1.9 GiB at 4K tokens, 2.8 GiB at 8K, 4.6 GiB at 16K and 8.2 GiB at 32K; docs/training.md has the table. Its data is the classics for now (about 4.3M tokens, so the model mostly memorizes); it changes once a larger mixture exists. Its training is one stage: 300 steps of 8 windows of 32K tokens; DeepSeek-V4's stages to 1M tokens (4K, 16K, 64K, 1M) are not set yet, since their steps and batches are the recipe's to choose. A GPU where 32K tokens do not fit trains it the same with --segment 8192 or --strategy split (docs/training.md, \"Long windows\")."
}
